{
  "schema_version": 1,
  "registry_id": "replace-with-separately-administered-registry",
  "generation": 1,
  "issued_at": "1970-01-01T00:00:00Z",
  "expires_at": "1970-01-01T00:00:01Z",
  "keys": [
    {
      "key_id": "replace-with-authority-key-id",
      "identity": "replace-with-authoritative-identity",
      "organization": "replace-with-authoritative-organization",
      "algorithm": "ed25519",
      "public_key_pem": "REPLACE WITH AN EXTERNALLY CUSTODIED ED25519 PUBLIC KEY",
      "public_key_sha256": "0000000000000000000000000000000000000000000000000000000000000000",
      "purposes": ["evidence_issuer"],
      "authority_classes": ["replace_with_authority_class"],
      "allowed_gap_ids": ["HG-0010"],
      "valid_from": "1970-01-01T00:00:00Z",
      "valid_until": "1970-01-01T00:00:01Z",
      "revoked_at": null,
      "independent_reviewer": false
    }
  ]
}
